{
  "用例目录": "销售 - 账号与权限 - 登录",
  "用例名称": "登录页面使用脱敏账号成功进入销售工作台",
  "需求ID": "REQ-FIXTURE-LOGIN",
  "前置条件": "1. 使用固定脱敏账号 fixture_user@example.invalid\n2. 账号具备销售工作台访问权限",
  "用例步骤": "1. 打开登录页并输入 fixture_user@example.invalid\n2. 输入 <REDACTED_PASSWORD> 并点击登录\n3. 观察工作台跳转",
  "预期结果": "1. 密码字段以掩码显示\n2. 登录成功且不暴露 token\n3. 页面进入销售工作台并显示当前用户",
  "用例类型": "功能测试",
  "用例状态": "正常",
  "用例等级": "高",
  "创建人": "fixture-author",
  "优先级": "P0",
  "是否可自动化": "是",
  "回归测试标识": "冒烟测试",
  "知识库关联": "fixture.login.authenticated_sales_workspace",
  "质量评分": 90.0
}
