{
  "用例目录": "销售 - 订单处理 - 导出",
  "用例名称": "导出当前销售订单查询结果且不带出运行时评分字段",
  "需求ID": "REQ-FIXTURE-EXPORT",
  "前置条件": "1. 用户已登录并拥有销售订单导出权限\n2. 当前列表已按状态待支付完成查询",
  "用例步骤": "1. 点击导出按钮\n2. 选择当前查询结果并确认导出\n3. 打开生成的xlsx文件查看表头",
  "预期结果": "1. 导出操作只使用当前查询结果\n2. 文件生成在运行时或workspace目标目录\n3. 正式表头固定15列且第15列为质量评分",
  "用例类型": "功能测试",
  "用例状态": "正常",
  "用例等级": "中",
  "创建人": "fixture-author",
  "优先级": "P1",
  "是否可自动化": "是",
  "回归测试标识": "全量回归",
  "知识库关联": "fixture.export.current_search_15_columns",
  "质量评分": 92.0,
  "_runtime_quality": {
    "original_score": 80.0,
    "optimized_score": 92.0,
    "final_score": 92.0,
    "score_history": [{"stage": "original", "score": 80.0}, {"stage": "optimized_1", "score": 92.0}],
    "score_threshold": 85.0,
    "is_cold_start": false,
    "confidence": 1.0,
    "optimization_attempts": 1,
    "needs_human_review": false,
    "final_audit_passed": true
  },
  "_runtime_quality_version": "1.0"
}
