{
  "用例目录": "销售 - 订单处理 - 清理",
  "用例名称": "测试结束后按依赖逆序清理脱敏销售订单数据",
  "需求ID": "REQ-FIXTURE-CLEANUP",
  "前置条件": "1. 已创建脱敏订单 SO-FIXTURE-0002 及其明细\n2. 清理API和DB兜底连接均使用测试环境",
  "用例步骤": "1. 执行订单清理任务\n2. 模拟API清理失败并执行DB兜底\n3. 查询订单、明细和关联客户是否仍存在",
  "预期结果": "1. 先清理后创建的明细再清理订单\n2. API失败时记录告警并执行DB兜底\n3. 订单及关联脱敏数据均不存在且不影响其他测试",
  "用例类型": "功能测试",
  "用例状态": "正常",
  "用例等级": "高",
  "创建人": "fixture-author",
  "优先级": "P1",
  "是否可自动化": "是",
  "回归测试标识": "模块回归",
  "知识库关联": "fixture.cleanup.cascade_and_fallback",
  "质量评分": 86.0,
  "_runtime_regeneration": {"count": 0, "last_regenerated_at": "2026-01-01T00:00:00+08:00"}
}
